<?xml version="1.0" encoding="UTF-8" standalone="yes"?>
<!DOCTYPE funcs
  SYSTEM '../../../clonk.dtd'>
<?xml-stylesheet type="text/xsl" href="../../../clonk.xsl"?>
<funcs>
  <func>
    <title>DigFree</title>
    <category>Landscape</category>
    <version>5.1 OC</version>
    <syntax>
      <rtype>int</rtype>
      <params>
        <param>
          <type>int</type>
          <name>x</name>
          <desc>X coordinate</desc>
        </param>
        <param>
          <type>int</type>
          <name>y</name>
          <desc>Y coordinate</desc>
        </param>
        <param>
          <type>int</type>
          <name>radius</name>
          <desc>Radius</desc>
        </param>
		<param>
          <type>bool</type>
          <name>no_dig2objects</name>
          <desc>Prevent objects from being dug out</desc>
        </param>
      </params>
    </syntax>
    <desc>Makes a circular hole in semi-solid materials. The return value is the amount of pixels that were dug free. If no_dig2objects is true, the dug out material does neither create objects according to the Dig2Objects in the <emlink href="material/ocm.html">*.ocm</emlink> nor will the amount be stored in the internal buffer.</desc>
    <examples>
      <example>
        <code>DigFree(700, 1500, 5);</code>
        <text>Makes a small hole in the middle of the landscape.</text>
      </example>
    </examples>
    <related>
      <funclink>DigFreeRect</funclink>
      <funclink>Explode</funclink>
    </related>
  </func>
  <author>jwk</author><date>2002-04</date>
</funcs>
