<?xml version="1.0" encoding="UTF-8" standalone="yes"?>
<!DOCTYPE funcs
  SYSTEM '../../../clonk.dtd'>
<?xml-stylesheet type="text/xsl" href="../../../clonk.xsl"?>
<funcs>
  <func>
    <title>VIS_All</title>
    <category>Objects</category>
    <subcat>Visibility</subcat>
    <version>4.9.1.0 GWE</version>
    <syntax><rtype>int</rtype></syntax>
    <desc>Constant for <funclink>GetVisibility</funclink>/<funclink>SetVisibility</funclink>. The object is visible for all. This is the default value 0 and kann logically not be combined with other VIS_x values.</desc>
    <remark>This value is also defined as a constant. Thus the parameter brackets can be omitted.</remark>
    <examples>
      <example>
        <code>for(var obj in FindObjects()) SetVisibility(VIS_All, obj);</code>
        <text>Makes all objects visible.</text>
      </example>
    </examples>
    <related>
      <funclink>GetVisibility</funclink>
      <funclink>SetVisibility</funclink>
      <funclink>VIS_None</funclink>
      <funclink>VIS_Owner</funclink>
      <funclink>VIS_Allies</funclink>
      <funclink>VIS_Enemies</funclink>
      <funclink>VIS_God</funclink>
      <funclink>VIS_Local</funclink>
    </related>
  </func>
  <author>Sven2</author><date>2001-11</date>
</funcs>
