<?xml version="1.0" encoding="UTF-8" standalone="yes"?>
<!DOCTYPE doc
  SYSTEM '../../clonk.dtd'>
<?xml-stylesheet type="text/xsl" href="../../clonk.xsl"?>
<doc>
  <title>Scenario Folder</title>
  <h id="Folders">Scenario Folder</h>
  <part>
    <text>Scenario folders are used to group a number of scenarios. Scenario folders are displayed with a book icon in the startup screen which can then be opened to list contained scenarios.</text>
    <h id="Components">Scenario Components (c4s)</h>
    <dl>
      <dt id="c4s"><img height="16" src="../../images/icon_scenario.gif" width="16"/><emlink href="scenario/index.html">*.c4s</emlink></dt>
      <dd>
        <text>Scenario folders can contain any number of scenarios.</text>
      </dd>
      <dt id="c4f"><img height="16" src="../../images/icon_scenario_folder.gif" width="16"/>*.c4f</dt>
      <dd>
        <text>Scenario folders can also contain other scenario folders.</text>
      </dd>
      <dt id="Title"><img height="16" src="../../images/icon_image.gif" width="16"/>Title.png/Title.bmp</dt>
      <dd>
        <text>The title picture of the scenario folder in png format. Size: 200x150 pixel. The older bmp format with 256 colors is still supported as well.</text>
      </dd>
      <dt id="Iconbmp"><img height="16" src="../../images/icon_image.gif" width="16"/>Icon.bmp/Icon.png</dt>
      <dd>
        <text>The icon of a scenario folder which is to be displayed instead of the book icon. BMP format (obsolete): 16x16 pixels, color RGB 255 0 255 (purple) is transparent. PNG format: 24x24 pixels, alpha channel is used for transparency.</text>
      </dd>
      <dt id="Desc__rtf"><img height="16" src="../../images/icon_text.gif" width="16"/>Desc*.rtf</dt>
      <dd>
        <text>The description text of the scenario in rich text format (rtf). '__' is to be replaced by the two digit language code, e.g. DE for German and US for American English. Multiple descriptions for several languages can be contained in a scenario file of which the game will automatically load the one appropriate for the configured language.</text>
        <text>The font of the description text is set internally on display. The character size in the file should be 10pt for headings and 8pt for text. Images or other rtf tags are ignored.</text>
        <text>It is recommended to edit this file using a small scale rtf editor such as WordPad.exe in Windows and not a full-blown word processor such as Word as these will stuff kilobytes of unneeded extra information into the rtf file.</text>
      </dd>
      <dt id="Titletxt"><img height="16" src="../../images/icon_text.gif" width="16"/>Title.txt</dt>
      <dd>
        <text>By default, the title of a scenario is set when renaming the scenario in the menu system and stored in section [Head] of Scenario.txt. The file name of the scenario group file may differ. For language dependent titles you should create a Title.txt component with the appropriate contents:</text>
        <code>DE:Meine Rundensammlung
US:My scenario collection</code>        <text>Important: No quotation marks and special characters should be used.</text>
      </dd>
      <dt id="FolderMaptxt"><img height="16" src="../../images/icon_text.gif" width="16"/><emlink href="folder/foldermap.html">FolderMap.txt</emlink></dt>
      <dd>
        <text>From CR, scenario folders can also contain graphical folder maps for the selection of scenarios.</text>
      </dd>
      <dt id="Loader"><img height="16" src="../../images/icon_image.gif" width="16"/>Loader*.png/Loader*.bmp</dt>
      <dd>
        <text>Scenario folders can contain local loader screens. Also see <emlink href="scenario/index.html">scenarios</emlink>. The <emlink href="scenario/index.html#UeberladungenC4S">overloading rules</emlink> apply.</text>
      </dd>
      <dt id="Materialc4g"><img height="16" src="../../images/icon_system.gif" width="16"/><emlink href="material/index.html">Material.c4g</emlink></dt>
      <dd>
        <text>Scenario folders can contain local material definitions. Also see <emlink href="scenario/index.html#Materialc4g">scenarios</emlink>. The <emlink href="scenario/index.html#UeberladungenC4S">overloading rules</emlink> apply.</text>
      </dd>
      <dt id="Graphicsc4g"><img height="16" src="../../images/icon_system.gif" width="16"/>Graphics.c4g</dt>
      <dd>
        <text>Scenario folders can overload individual entries of the global Graphics.c4g group. See <emlink href="#UeberladungenC4S">overloading rules</emlink>.</text>
      </dd>
      <dt id="Musicc4g"><img height="16" src="../../images/icon_system.gif" width="16"/>Music.c4g</dt>
      <dd>
        <text>Scenario folders can contain local music files. Also see <emlink href="scenario/index.html#Musicc4g">scenarios</emlink>. The <emlink href="scenario/index.html#UeberladungenC4S">overloading rules</emlink> apply.</text>
      </dd>
      <dt id="c4d"><img height="16" src="../../images/icon_object_definition.gif" width="16"/><emlink href="definition/index.html">*.c4d</emlink></dt>
      <dd>
        <text>Scenario folders can contain object definitions, which will then be available in all scenarios contained in the folder.Also see <emlink href="scenario/index.html#c4d">scenarios</emlink>. The <emlink href="scenario/index.html#UeberladungenC4S">overloading rules</emlink> apply.</text>
      </dd>
      <dt id="Infotxt"><img height="16" src="../../images/icon_text.gif" width="16"/>Info.txt</dt>
      <dd>
        <text>Here an author can store additional information about the development of his scenario, his email address, or other information he wants to share with other developers.</text>
      </dd>
      <dt id="Authortxt"><img height="16" src="../../images/icon_text.gif" width="16"/>Author.txt</dt>
      <dd>
        <text>Should contain the name of the author in format "Firstname Lastname (Nick)" and is used to maintain the name of the original author, if the scenario group file is edited by another developer at a later point in time. The name stored here is only displayed, however, if the scenario was edited by RedWolf Design. This feature is mainly used for contest scenarios.</text>
      </dd>
    </dl>
  </part>
  <author>Sven2</author><date>2006-09</date>
</doc>
