<?xml version="1.0" encoding="UTF-8" standalone="yes"?>
<!DOCTYPE funcs
  SYSTEM '../../../clonk.dtd'>
<?xml-stylesheet type="text/xsl" href="../../../clonk.xsl"?>
<funcs>
  <func>
    <title>OCF_Container</title>
    <category>Objects</category>
    <subcat>OCF</subcat>
    <version>4.6.5.0 CP</version>
    <syntax><rtype>int</rtype></syntax>
    <desc>Object character flag: the object is a container with theoreticall accessible contents (e.g. a building with entrance, transport vehicle...)</desc>
    <remark>This value is also defined as a constant. Thus the parameter brackets can be omitted.</remark>
    <remark>For more information and examples regarding these constants see <emlink href="definition/ocf.html">object character flags</emlink>.</remark>
    <related>
      <funclink>GetOCF</funclink>
      <funclink>FindObject</funclink>
      <emlink href="definition/ocf.html">Object character flags</emlink>
    </related>
  </func>
  <author>Sven2</author><date>2002-05</date>
</funcs>
