<?xml version="1.0" encoding="UTF-8" standalone="yes"?>
<!DOCTYPE funcs
  SYSTEM '../../../clonk.dtd'>
<?xml-stylesheet type="text/xsl" href="../../../clonk.xsl"?>
<funcs>
  <func>
    <title>Split2Components</title>
    <category>Objects</category>
    <subcat>Existence</subcat>
    <version>4.6.5.0 CP</version>
    <syntax>
      <rtype>bool</rtype>
      <params>
        <param>
          <type>object</type>
          <name>obj</name>
          <desc>Object to be split. Can be 0 in local calls.</desc>
          <optional />
        </param>
      </params>
    </syntax>
    <desc>Splits an object into its components. The new component objects will be created with random rotation and a low speed in random direction at the position at which the object was located. The original object is removed. If the original object was contained, the new component objects will be created in the original container.</desc>
    <remark>See notice for <funclink>RemoveObject</funclink>.</remark>
    <examples>
      <example>
        <code>protected func ControlDigDouble()
  {
  var target=<funclink>Contents</funclink>();
  <funclink>if</funclink> (!target) <funclink>return</funclink>();
  Split2Components(target);
  return true;
  }</code>
        <text>Script for a clonk: He splits the first object he carries on double dig.</text>
      </example>
    </examples>
    <related>
      <funclink>RemoveObject</funclink>
      <funclink>GetComponent</funclink>
    </related>
  </func>
  <author>Sven2</author><date>2002-08</date>
</funcs>
