<?xml version="1.0" encoding="UTF-8" standalone="yes"?>
<!DOCTYPE funcs
  SYSTEM '../../../clonk.dtd'>
<?xml-stylesheet type="text/xsl" href="../../../clonk.xsl"?>
<funcs>
  <func>
    <title>C4D_Object</title>
    <category>Objects</category>
    <subcat>Category</subcat>
    <version>4.6.5.0 CP</version>
    <syntax><rtype>int </rtype></syntax>
    <desc>Object category: small item.</desc>
    <remark>This value is also defined as a constant. Thus the parameter brackets can be omitted.</remark>
    <examples>
      <example>
        <code><funclink>GetDefinition</funclink>(0, C4D_Object( ));</code>
        <text>Returns the id of the first loaded definition. Similar scripting is used in the research lab to list researchable object.</text>
      </example>
    </examples>
    <related>
      <funclink>GetCategory</funclink>
      <funclink>SetCategory</funclink>
      <funclink>GetHomebaseMaterial</funclink>
      <funclink>GetPlrKnowledge</funclink>
      <funclink>GetDefinition</funclink>
    </related>
  </func>
  <author>GÃ¼nther</author><date>2002-02</date>
</funcs>
